title,author,price,pages,avg_reviews,n_reviews,star5,star4,star3,star2,star1,publisher,media_avaliacao
Becoming a Data Head: How to Think Speak and Understand Data Science Statistics and Machine Learning,"[Alex J. Gutman,Jordan Goldmeier]",24.49,272,4.6,184,0.74,0.18,0.05,0.02,0.01,Wiley,0.308
Ace the Data Science Interview: 201 Real Interview Questions Asked FAANG Tech Startups & Wall Street,"[Nick Singh,Kevin Huo]",26,301,4.5,599,0.77,0.1,0.06,0.03,0.04,Ace the Data Science Interview (August 16 2021),0.302
Fundamentals of Data Engineering: Plan and Build Robust Data Systems,"[Joe Reis,Matt Housley]",50.76,446,5,33,0.96,0.04,0,0,0,OReilly Media,0.330666666666667
Essential Math for Data Science: Take Control of Your Data with Fundamental Linear Algebra Probability and Statistics,[Thomas Nield],44.8,347,4.5,27,0.79,0.05,0.05,0.05,0.05,OReilly Media,0.296666666666667
Data Science for Business: What You Need to Know about Data Mining and Data-Analytic Thinking,"[Foster Provost,Tom Fawcett]",36.99,413,4.5,970,0.71,0.15,0.08,0.03,0.03,OReilly Media,0.298666666666667
Data Science from Scratch: First Principles with Python,[Joel Grus],45.22,406,4.4,594,0.65,0.19,0.08,0.04,0.04,OReilly Media,0.291333333333333
Practical Statistics for Data Scientists: 50+ Essential Concepts Using R and Python,"[Peter Bruce,Andrew Bruce et al.]",24.88,368,4.6,655,0.76,0.14,0.06,0.02,0.02,OReilly Media,0.306666666666667
Python for Data Science: A Hands-On Introduction,[Yuli Vasiliev],28.49,240,4.3,6,0.78,0.22,0,0,0,No Starch Press (August 2 2022),0.318666666666667
Practical Linear Algebra for Data Science: From Core Concepts to Applications Using Python,[Mike Cohen],69.99,328,,0,0,0,0,0,0,OReilly Media,0
Data Science (The MIT Press Essential Knowledge series),,9.61,280,4.5,383,0.68,0.21,0.06,0.03,0.02,The MIT Press,0.3
Data Science For Dummies (For Dummies (Computer/Tech)),[Lillian Pierson],25.49,432,4.6,35,0.73,0.17,0.1,0,0,For Dummies,0.308666666666667
Azure Data Engineer Associate Certification Guide: A hands-on reference guide to developing your data engineering skills and preparing for the DP-203 exam,[Newton Alex],49.99,574,4.1,16,0.56,0.28,0.16,0,0,Packt Publishing (February 28 2022),0.293333333333333
Data Pipelines with Apache Airflow,"[Bas P. Harenslak,Julian Rutger de Ruiter]",47.62,480,4.7,44,0.77,0.16,0.03,0.04,0,Manning (April 27 2021),0.310666666666667
Practical Data Science with Python: Learn tools and techniques from hands-on examples to extract insights from data,[Nathan George],51.99,620,4.7,21,0.82,0.08,0.09,0,0,Packt Publishing (September 30 2021),0.312666666666667
Data Science on AWS: Implementing End-to-End Continuous AI and Machine Learning Pipelines,"[Chris Fregly,Antje Barth]",31.99,521,4.4,135,0.7,0.14,0.05,0.07,0.04,OReilly Media,0.292666666666667
Data Analysis for Business Economics and Policy,"[Gábor Békés,Gábor Kézdi]",61.74,738,4.4,26,0.7,0.13,0.06,0.06,0.05,Cambridge University Press (May 6 2021),0.291333333333333
Machine Learning Design Interview: Machine Learning System Design Interview,[Khang Pham],34.15,210,3.6,57,0.47,0.15,0.08,0.07,0.22,Independently published (April 29 2022),0.236666666666667
Hands-On Data Analysis with Pandas: A Python data science handbook for data collection wrangling analysis and visualization 2nd Edition,"[Stefanie Molin,Ken Jee]",35.67,788,4.3,64,0.67,0.18,0.04,0.04,0.07,Packt Publishing,0.289333333333333
Business Data Science: Combining Machine Learning and Economics to Optimize Automate and Accelerate Business Decisions,[Matt Taddy],33.43,352,4.5,143,0.76,0.11,0.04,0.03,0.07,McGraw Hill,0.299333333333333
The Art of Statistics: How to Learn from Data,[David Spiegelhalter],17.99,448,4.6,2764,0.73,0.19,0.05,0.01,0.01,Basic Books (August 17 2021),0.306
Cleaning Data for Effective Data Science: Doing the other 80% of the work with Python R and command-line tools,[David Mertz],39.99,498,4.8,27,0.92,0.08,0,0,0,Packt Publishing (March 31 2021),0.328
Everything Data Analytics-A Beginners Guide to Data Literacy: Understanding the Processes That Turn Data Into Insights (Guides for Data Analytics Data Visualization and Communicating Data),,14.49,148,4.2,17,0.55,0.24,0.13,0.08,0,Kenneth Michael Fornari (May 24 2022),0.284
Effective Data Science Infrastructure: How to make data scientists productive,[Ville Tuulos],49.99,352,5,5,1,0,0,0,0,Manning (August 16 2022),0.333333333333333
Python Data Science Handbook: Essential Tools for Working with Data,[Jake VanderPlas],66.49,550,,0,0,0,0,0,0,OReilly Media,0
The Enterprise Big Data Lake: Delivering the Promise of Big Data and Data Science,[Alex Gorelik],40.1,224,4.3,71,0.59,0.21,0.11,0.05,0.04,OReilly Media,0.284
Data-Driven Science and Engineering: Machine Learning Dynamical Systems and Control,"[Steven L. Brunton,J. Nathan Kutz]",58.49,614,4.6,14,0.9,0.1,0,0,0,Cambridge University Press,0.326666666666667
Hands-On Data Science for Marketing: Improve your marketing strategies with machine learning using Python and R,[Yoon Hyup Hwang],44.99,464,4.3,63,0.59,0.23,0.09,0.06,0.03,Packt Publishing (March 29 2019),0.286
Be Data Driven: How Organizations Can Harness the Power of Data,[Jordan Morrow],34.99,240,5,1,1,0,0,0,0,Kogan Page,0.333333333333333
Data Science Projects with Python: A case study approach to gaining valuable insights from real data with machine learning 2nd Edition,[Stephen Klosterman],36.99,432,4.6,52,0.79,0.13,0.04,0.05,0,Packt Publishing,0.312666666666667
The Kaggle Book: Data analysis and machine learning for competitive data science,"[Konrad Banachewicz,Luca Massaron et al.]",39.94,530,4.6,68,0.81,0.05,0.05,0.07,0.02,Packt Publishing (April 22 2022),0.304
Think Like a Data Scientist: Tackle the data science process step--step,[Brian Godsey],29.59,328,4.5,31,0.6,0.36,0.02,0.02,0,Manning,0.302666666666667
Designing Data-Intensive Applications: The Big Ideas Behind Reliable Scalable and Maintainable Systems,[Martin Kleppmann],23.37,611,4.8,3167,0.85,0.09,0.03,0.01,0.02,OReilly Media,0.316
Data Smart: Using Data Science to Transform Information into Insight,[John W. Foreman],21.1,432,4.5,346,0.7,0.17,0.07,0.04,0.02,Wiley,0.299333333333333
Python for Data Analysis: Data Wrangling with pandas NumPy and Jupyter,[Wes McKinney],62.99,579,5,1,1,0,0,0,0,OReilly Media,0.333333333333333
Modern Data Science with R (Chapman & Hall/CRC Texts in Statistical Science),,72.59,632,3.9,9,0.69,0.15,0.15,0,0,Chapman and Hall/CRC,0.3
Machine Learning: 4 Books in 1: The #1 Beginners Guide to Master the Basics of Python Programming Learn the Art of Data Science and Build Artificial Intelligence,[Andrew Park],25.97,342,4.6,344,0.81,0.1,0.03,0.01,0.05,Independently published (July 20 2022),0.307333333333333
Building Big Data Pipelines with Apache Beam: Use a single programming model for both batch and stream data processing,[Jan Lukavsky],46.99,342,3.9,11,0.55,0.19,0.13,0.13,0,Packt Publishing (January 21 2022),0.277333333333333
Algorithmic Finance: A Companion To Data Science,[Christopher Hian-ann Ting],116.85,408,,0,0,0,0,0,0,WSPC (May 6 2022),0
Naked Statistics: Stripping the Dread from the Data,,11.69,304,4.6,2271,0.72,0.19,0.06,0.02,0.02,W. W. Norton & Company,0.306666666666667
Bayesian Ideas and Data Analysis: An Introduction for Scientists and Statisticians (Chapman & Hall/CRC Texts in Statistical Science),,64.1,516,4,14,0.55,0.19,0.08,0.1,0.08,CRC Press,0.268666666666667
Julia Data Science,"[Jose Storopoli,Rik Huijzer et al.]",31.99,170,4.5,9,0.74,0.26,0,0,0,Independently published (October 28 2021),0.316
Listening to People: A Practical Guide to Interviewing Participant Observation Data Analysis and Writing It All Up (Chicago Guides to Writing Editing and Publishing),,19,333,4.5,33,0.73,0.16,0.07,0.05,0,University of Chicago Press (October 15 2021),0.306666666666667
Doing Data Science: Straight Talk from the Frontline,"[""Cathy ONeil"",Rachel Schutt]",26.3,408,4.3,172,0.6,0.24,0.07,0.05,0.03,OReilly Media,0.286666666666667
Microsoft Power BI Quick Start Guide: Bring your data to life through data modeling visualization digital storytelling and more 2nd Edition,"[Devin Knight,Mitchell Pearson et al.]",28.49,294,4.3,142,0.57,0.23,0.14,0.03,0.02,Packt Publishing,0.284666666666667
R in Action Third Edition: Data analysis and graphics with R and Tidyverse,[Robert I. Kabacoff],56.99,656,4.6,8,0.82,0.18,0,0,0,Manning,0.321333333333333
Data Science Ethics: Concepts Techniques and Cautionary Tales,[David Martens],37.2,272,5,2,1,0,0,0,0,Oxford University Press (June 24 2022),0.333333333333333
Data Science and Machine Learning: Mathematical and Statistical Methods (Chapman & Hall/CRC Machine Learning & Pattern Recognition),,77.43,510,4.8,37,0.84,0.09,0.07,0,0,Chapman and Hall/CRC,0.318
Data Mesh in Action,"[Jacek Majchrzak,Sven Balnojan et al.]",69.99,300,,0,0,0,0,0,0,Manning (November 22 2022),0
The Machine Learning Solutions Architect Handbook: Create machine learning platforms to run solutions in an enterprise setting,[David Ping],43.97,442,4.7,39,0.82,0.12,0.06,0,0,Packt Publishing (January 21 2022),0.317333333333333
Practical Big Data Analytics: Hands-on techniques to implement enterprise analytics and machine learning using Hadoop Spark NoSQL and R,[Nataraj Dasgupta],44.99,412,3.8,7,0.49,0.17,0.17,0.17,0,Packt Publishing (January 15 2018),0.265333333333333
Simplify Big Data Analytics with Amazon EMR: A beginners guide to learning and implementing Amazon EMR for building data analytics solutions,[Sakti Mishra],46.99,430,5,9,1,0,0,0,0,Packt Publishing (March 25 2022),0.333333333333333
Bootstrap:Data Science Workbook,"[Emmanuel Schanzer,Kathi Fisler et al.]",4.73,148,,0,0,0,0,0,0,Lulu.com (August 14 2020),0
Amazon Redshift Cookbook: Recipes for building modern data warehousing solutions,"[Shruti Worlikar,Thiyagarajan Arumugam et al.]",51.99,384,4.5,23,0.66,0.24,0.11,0,0,Packt Publishing (July 23 2021),0.306
SQL for Data Analytics: Harness the power of SQL to extract insights from data 3rd Edition,"[Jun Shan,Matt Goldwasser et al.]",44.99,540,5,6,1,0,0,0,0,Packt Publishing,0.333333333333333
Communicating with Data: Making Your Case With Data,[Carl Allchin],40.99,340,5,4,1,0,0,0,0,OReilly Media,0.333333333333333
Data Analytics: A Small Data Approach (Chapman & Hall/CRC Data Science Series),,89.95,257,5,2,1,0,0,0,0,Chapman and Hall/CRC,0.333333333333333
Data Structures the Fun Way: An Amusing Adventure with Coffee-Filled Examples,[Jeremy Kubica],29.99,304,,0,0,0,0,0,0,No Starch Press (November 8 2022),0
Data Analysis with R - Second Edition: A comprehensive guide to manipulating analyzing and visualizing data in R,[Tony Fischetti],38.82,570,4.4,20,0.74,0.07,0.08,0.11,0,Packt Publishing,0.296
Data Engineering with AWS: Learn how to design and build cloud-based data transformation pipelines using AWS,[Gareth Eagar],39.99,482,4.4,48,0.63,0.22,0.08,0.03,0.04,Packt Publishing (December 29 2021),0.291333333333333
Data Science: Advanced Guide to Learn the Realms of Data Science Effectively,[Benjamin Smith],19.99,212,,0,0,0,0,0,0,Independently published (January 4 2021),0
Data Science for Supply Chain Forecasting,[Nicolas Vandeput],49.39,280,4.6,63,0.71,0.16,0.11,0.02,0,De Gruyter,0.304
Heard In Data Science Interviews: Over 650 Most Commonly Asked Interview Questions & Answers,[Kal Mishra],37.99,240,3.2,52,0.37,0.07,0.2,0.13,0.23,CreateSpace Independent Publishing Platform (October 3 2018),0.214666666666667
DATA ANALYTICS: A Comprehensive Beginner’s Guide To Learn About The Realms Of Data Analytics From A-Z,[Mr Benjamin Smith],19.99,153,4.2,37,0.59,0.15,0.2,0.06,0,Independently published (April 26 2020),0.284666666666667
Introduction to Data Science: Data Analysis and Prediction Algorithms with R (Chapman & Hall/CRC Data Science Series),,77.28,713,4.8,34,0.86,0.07,0.05,0.02,0,Chapman and Hall/CRC,0.318
Introduction to Machine Learning with R: Rigorous Mathematical Analysis,[Scott V. Burger],49.99,226,4.1,21,0.59,0.09,0.19,0.07,0.07,OReilly Media,0.272666666666667
PYTHON FOR DATA SCIENCE: The Ultimate Beginners’ Guide to Learning Python Data Science Step Step,[Mr Ethan Williams],19.99,199,4.3,68,0.62,0.19,0.08,0.06,0.05,Independently published (August 18 2019),0.284666666666667
97 Things About Ethics Everyone in Data Science Should Know: Collective Wisdom from the Experts,[Bill Franks],30.99,346,4.1,18,0.63,0.13,0.08,0.08,0.08,OReilly Media,0.276666666666667
Data Science for Marketing Analytics: A practical guide to forming a killer marketing strategy through data analysis with Python 2nd Edition,"[Mirza Rahim Baig,Gururajan Govindan et al.]",36.99,636,4.6,51,0.61,0.34,0.05,0,0,Packt Publishing,0.304
Video Data Analysis: How to Use 21st Century Video in the Social Sciences,"[Anne Nassauer,Nicolas M. Legewie]",45,320,5,1,1,0,0,0,0,SAGE Publications Ltd,0.333333333333333
The Beginners Guide to Data Science,"[Robert Ball,Brian Rague]",69.99,382,,0,0,0,0,0,0,Springer,0
Hands-On Data Science with R: Techniques to perform data manipulation and mining to build smart analytical models using R,"[Vitor Bianchi Lanzetta,Nataraj Dasgupta et al.]",39.99,420,4.1,5,0.37,0.4,0.23,0,0,Packt Publishing (November 30 2018),0.276
The Data Science Handbook: Advice and Insights from 25 Amazing Data Scientists,"[Carl Shan,William Chen et al.]",24.99,346,4.4,55,0.71,0.11,0.1,0.07,0.01,Data Science Bookshelf The (June 19 2015),0.296
Machine Learning and Data Science Blueprints for Finance: From Building Trading Strategies to Robo-Advisors Using Python,"[Hariom Tatsat,Sahil Puri et al.]",44.49,432,4.3,51,0.66,0.16,0.07,0.04,0.07,OReilly Media,0.286666666666667
Practical Python Data Wrangling and Data Quality: Getting Started with Reading Cleaning and Analyzing Data,[Susan McGregor],31.99,,3.5,2,0.5,0.5,0,0,0,OReilly Media,0.3
Cracking the Data Science Interview: 101+ Data Science Questions & Solutions,[Maverick Lin],11.99,119,3.7,48,0.44,0.2,0.17,0.03,0.16,Independently published (December 17 2019),0.248666666666667
SQL for Data Scientists: A Beginners Guide for Building Datasets for Analysis,[Renee M. P. Teate],32.49,288,4.7,54,0.75,0.2,0.04,0,0,Wiley,0.311333333333333
MLOps Engineering at Scale,[Carl Osipov],44.49,344,4.2,3,0.62,0.38,0,0,0,Manning (March 1 2022),0.308
The Data Science Design Manual (Texts in Computer Science),,52.05,462,4.8,63,0.86,0.09,0.03,0.02,0,Springer,0.319333333333333
Big Data: A Very Short Introduction (Very Short Introductions),[Dawn E. Holmes],11.07,144,4.4,72,0.67,0.16,0.09,0.07,0.02,Oxford University Press,0.294666666666667
SQL for Data Analysis: Advanced Techniques for Transforming Data into Insights,[Cathy Tanimura],40.49,360,4.7,50,0.78,0.19,0.03,0,0,OReilly Media,0.316666666666667
The Cyberwarrior Handbook: A Beginners Guide to Hacking from Recon to Exploitation,[OccupyTheWeb],49.99,352,,0,0,0,0,0,0,No Starch Press (February 7 2023),0
Comet for Data Science: Enhance your ability to manage and optimize the life cycle of your data science project,"[Angelica Lo Duca,Gideon Mendels]",44.99,402,5,2,1,0,0,0,0,Packt Publishing (August 26 2022),0.333333333333333
Optimization for Data Analysis,"[Stephen J. Wright,Benjamin Recht]",38.91,238,5,2,1,0,0,0,0,Cambridge University Press,0.333333333333333
The Self-Taught Computer Scientist: The Beginners Guide to Data Structures & Algorithms,[Cory Althoff],19.49,224,4.5,87,0.75,0.08,0.12,0.02,0.03,Wiley,0.3
Quantitative Social Science: An Introduction in tidyverse,"[Kosuke Imai,Nora Webb Williams]",49.99,488,3.8,3,0.61,0.39,0,0,0,Princeton University Press (August 2 2022),0.307333333333333
Data Science Interview: Prep for SQL Panda Python R Language Machine Learning DBMS and RDBMS – And More – The Full Data Scientist Interview Handbook,[DSI ACE PREP],24.99,156,4.7,44,0.91,0.04,0.05,0,0,Data Science Interview Books (January 6 2022),0.324
The Data Vault Guru: a pragmatic guide on building a data vault,[Mr Patrick Cuba],76.96,676,4.1,13,0.57,0.23,0.1,0.1,0,Independently published (October 6 2020),0.284666666666667
Responsible Data Science,"[Grant Fleming,Peter C. Bruce]",19.86,304,3.8,8,0.7,0.3,0,0,0,Wiley,0.313333333333333
Fundamentals of Data Science with MATLAB: Introduction to Scientific Computing Data Analysis and Data Visualization,[Arash Karimpour],26,424,4.5,4,0.5,0.5,0,0,0,Arash Karimpour (July 31 2020),0.3
Python for Data Science: Clear and Complete Guide to Data Science and Analysis with Python,[Alex Campbell],14.95,197,3.9,9,0.62,0.15,0.23,0,0,Independently published (August 15 2021),0.292666666666667
Learn Power BI: A comprehensive step--step guide for beginners to learn real-world business intelligence 2nd Edition,[Greg Deckler],44.64,458,4.4,30,0.66,0.17,0.09,0.08,0,Packt Publishing,0.294
Data Visualization with Excel Dashboards and Reports,[Dick Kusleika],22.99,352,4.4,77,0.63,0.27,0.03,0.04,0.02,Wiley,0.294666666666667
Data Science For Dummies 2nd Edition,"[Lillian Pierson,Jake Porway]",41.02,384,4.4,205,0.6,0.24,0.13,0.02,0.02,For Dummies,0.294
Hands-On Data Structures and Algorithms with Python: Store manipulate and access data effectively and boost the performance of your applications 3rd Edition,[Dr. Basant Agarwal],44.99,496,4.6,5,0.58,0.42,0,0,0,Packt Publishing,0.305333333333333
Business Intelligence Analytics and Data Science: A Managerial Perspective,"[Ramesh Sharda,Dursun Delen et al.]",106.66,512,4.5,273,0.77,0.08,0.07,0.02,0.05,Pearson,0.298
Guide to Data Science: Brief Introduction to the Quirky World of Data,[Aryan Goyal],14.99,151,5,1,1,0,0,0,0,Independently published (August 15 2022),0.333333333333333
Machine Learning for Time Series Forecasting with Python,[Francesca Lazzeri],32.49,224,3.9,43,0.53,0.07,0.25,0.12,0.04,Wiley,0.264
Introduction to Computation: Haskell Logic and Automata (Undergraduate Topics in Computer Science),,33.9,382,5,3,1,0,0,0,0,Springer,0.333333333333333
Data Science: Concepts and Practice,"[Vijay Kotu,Bala Deshpande]",69.34,568,4.5,9,0.68,0.16,0.16,0,0,Morgan Kaufmann,0.301333333333333
Inferential Network Analysis (Analytical Methods for Social Research),,54.81,314,4.7,7,0.69,0.31,0,0,0,Cambridge University Press (January 7 2021),0.312666666666667
Data Science In The Library: Tools and Strategies for Supporting Data-Driven Research and Instruction,[Joel Herndon],80.31,224,,0,0,0,0,0,0,Facet Publishing,0
Foundational Python for Data Science (Addison-Wesley Data & Analytics Series),,39.99,256,4.3,7,0.5,0.31,0.19,0,0,Pearson,0.287333333333333
Integrating Data,"[Bill Inmon,Patty Haines et al.]",39.95,134,5,1,1,0,0,0,0,Technics Publications,0.333333333333333
Bioinformatics Data Skills: Reproducible and Robust Research with Open Source Tools,[Vince Buffalo],45.77,536,4.6,109,0.73,0.18,0.05,0.02,0.02,OReilly Media,0.305333333333333
Python Crash Course 2nd Edition: A Hands-On Project-Based Introduction to Programming,[Eric Matthes],21.49,544,4.7,7425,0.81,0.13,0.04,0.01,0.01,No Starch Press,0.314666666666667
The Esri Guide to GIS Analysis Volume 3: Modeling Suitability Movement and Interaction (The ESRI Guide to GIS Analysis 3),[Andy Mitchell],33.93,420,4.4,27,0.7,0.11,0.1,0.09,0,Esri Press,0.294666666666667
The Applied SQL Data Analytics Workshop: Develop your practical skills and prepare to become a professional data analyst 2nd Edition,"[Matt Goldwasser,Upom Malik et al.]",34.99,484,4.6,40,0.71,0.21,0.08,0,0,Packt Publishing (February 28 2020),0.308666666666667
Data Mesh: Delivering Data-Driven Value at Scale,[Zhamak Dehghani],51.89,384,4.5,101,0.71,0.15,0.09,0.06,0,OReilly Media,0.302666666666667
End-to-End Data Science with SAS®: A Hands-On Programming Guide,[James Gearheart],39.95,380,4.5,17,0.66,0.25,0.09,0,0,SAS Institute (June 29 2020),0.304666666666667
An Introduction to Data Science,"[Jeffrey S. Saltz,Jeffrey M. Stanton]",44.86,288,4.4,75,0.65,0.22,0.06,0.04,0.03,SAGE Publications Inc,0.294666666666667
Probabilistic Machine Learning: An Introduction (Adaptive Computation and Machine Learning series),,99,864,4.4,73,0.76,0.05,0.08,0.02,0.08,The MIT Press (March 1 2022),0.290666666666667
Computer Science Unleashed: Harness the Power of Computational Systems,,29.95,268,4.9,25,0.94,0.06,0,0,0,Code Energy (March 17 2021),0.329333333333333
R Statistics Cookbook: Over 100 recipes for performing complex statistical operations with R 3.5,[Francisco Juretig],24.99,448,4.6,22,0.64,0.29,0.07,0,0,Packt Publishing (March 29 2019),0.304666666666667
Introduction to Statistics: An Intuitive Guide for Analyzing Data and Unlocking Discoveries,[Jim Frost],18.91,255,4.5,199,0.72,0.15,0.05,0.03,0.04,Statistics Jim Publishing (August 13 2020),0.296666666666667
Algorithms and Data Structures for Massive Datasets,"[Dzejla Medjedovic,Emin Tahirovic et al.]",59.99,304,3.8,3,0.38,0.62,0,0,0,Manning (July 5 2022),0.292
Data Science (Chapman & Hall/CRC Data Science Series),"[Tiffany Timbers,Trevor Campbell et al.]",59.95,442,,0,0,0,0,0,0,Chapman and Hall/CRC,0
Data Democratization with Domo: Bring together every component of your business to make better data-driven decisions using Domo,[Jeff Burtenshaw],49.99,576,4.8,6,0.78,0.22,0,0,0,Packt Publishing (June 17 2022),0.318666666666667
Determann’s Field Guide to Data Privacy Law: International Corporate Compliance (Elgar Compliance Guides),[Lothar Determann],73.08,256,,0,0,0,0,0,0,Edward Elgar Publishing,0
Data Visualization with Python for Beginners: Visualize Your Data using Pandas Matplotlib and Seaborn (Machine Learning & Data Science for Beginners),,19.99,288,4.1,61,0.51,0.23,0.14,0.05,0.07,AI Publishing LLC (February 14 2020),0.270666666666667
Practical Synthetic Data Generation: Balancing Privacy and the Broad Availability of Data,"[Khaled El Emam,Lucy Mosquera et al.]",28.49,166,4.1,14,0.48,0.27,0.15,0.1,0,OReilly Media,0.275333333333333
Data Analysis in Sports Science,"[Gabriel J. Sanders PhD,Corey A. Peacock PhD]",59.99,130,4.7,7,0.68,0.32,0,0,0,Independently published (August 7 2018),0.312
Python for Geospatial Data Analysis: Theory Tools and Practice for Location Intelligence,[Bonny McClain],66.49,200,,0,0,0,0,0,0,OReilly Media,0
Data Science for Librarians (Library and Information Science Text Series),,65,168,5,2,1,0,0,0,0,Libraries Unlimited (March 26 2020),0.333333333333333
Basketball Data Science: With Applications in R (Chapman & Hall/CRC Data Science Series),,43.35,219,4.1,20,0.61,0.12,0.12,0.07,0.07,Chapman and Hall/CRC,0.273333333333333
Data Analytics for Absolute Beginners: A Deconstructed Guide to Data Literacy: (Introduction to Data Data Visualization Business Intelligence & ... Science Python & Statistics for Beginners),,14.9,153,4.4,309,0.67,0.19,0.09,0.03,0.03,Independently published (July 21 2019),0.298
Bayesian Data Analysis (Chapman & Hall/CRC Texts in Statistical Science),,78.22,675,4.7,200,0.81,0.11,0.05,0.03,0.01,Chapman and Hall/CRC,0.314
Murachs Python for Data Analysis (Training & Reference),[Scott Mccoy],58.33,559,4.6,22,0.69,0.25,0.07,0,0,Mike Murach & Associates Inc (August 30 2021),0.310666666666667
Cracking the Coding Interview: 189 Programming Questions and Solutions,[Gayle Laakmann McDowell],35.95,687,4.7,7563,0.81,0.12,0.04,0.01,0.02,CareerCup,0.312666666666667
Docker for Data Science: Building Scalable and Extensible Data Infrastructure Around the Jupyter Notebook Server,[Joshua Cook],49.49,278,3.7,10,0.29,0.27,0.27,0.17,0,Apress,0.245333333333333
Mastering PostgreSQL 13: Build administer and maintain database applications efficiently with PostgreSQL 13 4th Edition,[Hans-Jurgen Schonig],41.99,476,4.2,35,0.64,0.1,0.12,0.09,0.04,Packt Publishing,0.278666666666667
Data Analysis with Python and PySpark,[Jonathan Rioux],48,456,4.8,7,0.8,0.2,0,0,0,Manning (March 22 2022),0.32
PYTHON: Learn Coding Programs with Python Programming and Master Data Analysis & Analytics Data Science and Machine Learning with the Complete Crash Course for Beginners - 5 Manuscripts in 1 Book,[TechExp Academy],24.9,400,4.2,282,0.61,0.14,0.11,0.05,0.08,Independently published (December 24 2021),0.274666666666667
DATA SCIENCE WITH PYTHON: Complete Guide To Understanding Data Analytics And Data Science With Python Programming (Code tutorials),[Craig Berg],9.98,138,,0,0,0,0,0,0,Independently published (June 17 2020),0
Data Analytics: Practical Guide to Leveraging the Power of Algorithms Data Science Data Mining Statistics Big Data and Predictive Analysis to Improve Business Work and Life,[Arthur Zhang],11.97,280,3.7,17,0.5,0.13,0.07,0.18,0.12,CreateSpace Independent Publishing Platform (March 10 2017),0.247333333333333
Introduction to Machine Learning,[Etienne Bernard],29.6,424,4.4,11,0.7,0.17,0.13,0,0,Wolfram Media Inc (December 20 2021),0.304666666666667
Hands-On Data Structures and Algorithms with Kotlin: Level up your programming skills understanding how Kotlins data structure works,"[Chandra Sekhar Nayak,Rivu Chakraborty]",36.99,220,3.6,4,0.65,0.35,0,0,0,Packt Publishing (February 28 2019),0.31
Asking Smarter Questions: How To Be an Agent of Insight (Using Data Better),[Sam Knowles],39.95,280,,0,0,0,0,0,0,Routledge,0
Scalable Data Analytics with Azure Data Explorer: Modern ways to query analyze and perform real-time data analysis on large volumes of data,"[Jason Myerscough,Arunee Singhchawla]",51.99,364,5,8,1,0,0,0,0,Packt Publishing (March 17 2022),0.333333333333333
The Political Philosophy of AI: An Introduction,[Mark Coeckelbergh],19.59,176,3.7,7,0.52,0.14,0.17,0.17,0,Polity,0.267333333333333
Transformers for Machine Learning: A Deep Dive (Chapman & Hall/CRC Machine Learning & Pattern Recognition),"[Uday Kamath,Kenneth Graham et al.]",54.95,257,3.9,8,0.68,0.16,0.16,0,0,Chapman and Hall/CRC,0.301333333333333
Predictive Analytics: Data Mining Machine Learning and Data Science for Practitioners (Pearson Business Analytics Series),[Dursun Delen],47.49,350,4.1,12,0.6,0.11,0.18,0.11,0,Pearson FT Press,0.28
Pre-K-12 Guidelines for Assessment and Instruction in Statistics Education II (GAISE II): A Framework for Statistics and Data Science Education,"[Anna Bargagliotti,Christine Franklin et al.]",15,122,5,4,1,0,0,0,0,American Statistical Association (December 3 2020),0.333333333333333
